{
  "schemaVersion": 2,
  "id": "2026-07-23-coreyhaines31-marketingskills",
  "sourceId": "coreyhaines31-marketingskills",
  "snapshotId": "2026-07-23-coreyhaines31-marketingskills",
  "observedAt": "2026-07-23T09:08:12Z",
  "inspectedCommit": "c21a984a56da10fb6085e6334f6f60929220a4da",
  "collectorVersion": "0.1.0",
  "independentCounts": [
    {
      "kind": "marketplace-entry",
      "count": 1
    },
    {
      "kind": "plugin-manifest",
      "count": 1
    },
    {
      "kind": "repository-record",
      "count": 1
    },
    {
      "kind": "skill-file",
      "count": 48
    }
  ],
  "snapshotContentSha256": "2652f28194c95f3961b4d0326787daaa8a48b3efddb9886128654c7cc343bd59"
}
