{
  "schemaVersion": 2,
  "id": "2026-07-23-composio-awesome-claude-skills",
  "sourceId": "composio-awesome-claude-skills",
  "snapshotId": "2026-07-23-composio-awesome-claude-skills",
  "observedAt": "2026-07-23T09:08:12Z",
  "inspectedCommit": "92568c1edaff1bde5371154f036d959346c145a8",
  "collectorVersion": "0.1.0",
  "independentCounts": [
    {
      "kind": "marketplace-entry",
      "count": 107
    },
    {
      "kind": "plugin-manifest",
      "count": 1
    },
    {
      "kind": "repository-record",
      "count": 37
    },
    {
      "kind": "skill-file",
      "count": 864
    }
  ],
  "snapshotContentSha256": "6230f8f041b7253ef845f988a21a3508f63d5c55f3e58ee03c984a7f49a435d3"
}
