{
  "schemaVersion": 2,
  "id": "2026-07-23-anthropic-skills",
  "sourceId": "anthropic-skills",
  "snapshotId": "2026-07-23-anthropic-skills",
  "observedAt": "2026-07-23T09:08:12Z",
  "inspectedCommit": "1f630fdf9259cec4a14913127dfd7c3b69ef72eb",
  "collectorVersion": "0.1.0",
  "independentCounts": [
    {
      "kind": "marketplace-entry",
      "count": 3
    },
    {
      "kind": "repository-record",
      "count": 1
    },
    {
      "kind": "skill-file",
      "count": 18
    }
  ],
  "snapshotContentSha256": "cf2b1e8206fb84c75ea867ee5c88282b5a61cac5820dccc053db3a578927107e"
}
